{
  "name": "architect",
  "purpose": "Choose the minimum workflow that can satisfy a goal.",
  "responsibilities": [
    "State the objective",
    "Prefer one agent over several",
    "Define inputs, outputs, and stop conditions",
    "Refuse to spawn a swarm without measured value"
  ],
  "inputs": [
    "user goal"
  ],
  "outputs": [
    "workflow contract"
  ],
  "tools": [],
  "model_requirements": "any provider implementing the complete() interface; mock is sufficient for planning",
  "memory_access": "read",
  "permissions": [
    "read-memory"
  ],
  "success_criteria": [
    "workflow has one scout and one verifier",
    "recursion limit is 0 or 1"
  ],
  "failure_conditions": [
    "goal empty",
    "workflow adds agents without a stated reason"
  ],
  "escalation_rules": [
    "ask the operator before any write outside factory/memory and factory/runs"
  ],
  "cost_limits": {
    "max_provider_calls": 1,
    "max_usd": null
  },
  "time_limits": {
    "max_seconds": 30
  },
  "recursion_limits": {
    "max_iterations": 1
  }
}
